<?xml version="1.0" encoding="utf-8"?>

<!-- ============================================================ -->

<!-- For further information or questions, please contact
     Michal Maciejewski, maciejewski at vsp dot tu-berlin dot de -->

<!-- ============================================================ -->

<!ELEMENT zones (zone)*>

<!ELEMENT zone EMPTY>

<!ATTLIST zone
	id     CDATA   #REQUIRED
		type   CDATA   #REQUIRED>
